{
  "schema_version": "1.0",
  "product_version": "1.0.0",
  "status": "APPROVED",
  "last_approved_at": "2026-09-01",
  "approved_by": "user",
  "flows": [
    {
      "id": "FLOW-001", "name": "首次启动与权限",
      "actors": ["用户", "系统权限", "蓝牙适配器", "Capability Detection"],
      "preconditions": ["已安装 App 或进入小程序"],
      "happy_path": ["启动→平台识别", "落扫描 Tab（不索取权限）", "点击开始扫描触发能力检测与最小权限申请（DEC-003）", "授权后扫描运行"],
      "error_paths": ["ERR-PERM-01 拒绝重试", "ERR-PERM-03 永久拒绝去设置", "ERR-PERM-02 环境要求定位未授权（仅能力检测命中）", "ERR-PERM-04 环境要求位置服务未开（仅能力检测命中）", "ERR-BT-01 蓝牙关去开启", "ERR-BT-02 适配器失败重试", "H5 UNSUPPORTED 引导"],
      "cancel_and_cleanup": ["退出无残留；扫描资源随页面释放"],
      "pages": ["PAGE-001"], "mermaid_diagrams": 2,
      "planned_tests": ["TEST-A-001", "TEST-W-001", "TEST-P-001"],
      "evidence_id": "EVID-001", "release_blocking": true
    },
    {
      "id": "FLOW-002", "name": "两轮扫描",
      "actors": ["用户", "ScanSession"],
      "preconditions": ["FLOW-001 就绪"],
      "happy_path": ["第一轮 10 秒完成保留结果（DEC-013，可手动停止）", "再次开始（可立即）生成新 generation", "迟到事件丢弃", "列表重建 N/M 实时"],
      "error_paths": ["ERR-SCAN-01 重试"],
      "cancel_and_cleanup": ["停止/hide/unload 均停止并清理计时器"],
      "pages": ["PAGE-001"], "mermaid_diagrams": 2,
      "planned_tests": ["TEST-U-005", "TEST-I-002", "TEST-A-005", "TEST-W-007", "TEST-E-001"],
      "evidence_id": "EVID-001", "release_blocking": true
    },
    {
      "id": "FLOW-003", "name": "广播详情",
      "actors": ["用户", "广播归一层"],
      "preconditions": ["设备在列表"],
      "happy_path": ["点卡开弹窗", "字段+原始字节展示", "复制字段"],
      "error_paths": ["解析失败段标注原始 HEX"],
      "cancel_and_cleanup": ["关弹窗无残留"],
      "pages": ["PAGE-001"], "mermaid_diagrams": 2,
      "planned_tests": ["TEST-U-008", "TEST-A-005", "TEST-E-001"],
      "evidence_id": "EVID-003", "release_blocking": true
    },
    {
      "id": "FLOW-004", "name": "连接与服务发现",
      "actors": ["用户", "连接服务", "设备"],
      "preconditions": ["设备已发现", "权限就绪"],
      "happy_path": ["点连接停扫", "attempt 去重连接", "服务发现", "树展示并注册 Registry"],
      "error_paths": ["ERR-CONN-01 重试", "ERR-CONN-02 断开重连", "ERR-CONN-03 空服务重试", "被动断开 3 次重连后 ERR-CONN-05 手动"],
      "cancel_and_cleanup": ["失败清理半开连接；重连窗口结束清理计时"],
      "pages": ["PAGE-001", "PAGE-006", "PAGE-007"], "mermaid_diagrams": 2,
      "planned_tests": ["TEST-I-003", "TEST-A-006", "TEST-A-007", "TEST-W-007", "TEST-E-002", "TEST-E-005"],
      "evidence_id": "EVID-001", "release_blocking": true
    },
    {
      "id": "FLOW-005", "name": "Read/Write/Notify",
      "actors": ["用户", "GATT 服务", "设备"],
      "preconditions": ["FLOW-004 完成"],
      "happy_path": ["Read 3s 值+日志", "TEXT/HEX 写入队列出设备响应", "Notify 开关推送流"],
      "error_paths": ["ERR-GATT-01/03/04/05/07 各自重试", "ERR-GATT-02 属性禁用"],
      "cancel_and_cleanup": ["订阅关闭双断；离开页面按 DEC-009"],
      "pages": ["PAGE-006"], "mermaid_diagrams": 2,
      "planned_tests": ["TEST-U-009", "TEST-U-010", "TEST-U-011", "TEST-U-012", "TEST-I-004", "TEST-I-005", "TEST-A-008", "TEST-E-003", "TEST-E-004", "TEST-E-005"],
      "evidence_id": "EVID-001", "release_blocking": true
    },
    {
      "id": "FLOW-006", "name": "跨页 Session",
      "actors": ["用户", "Session Registry"],
      "preconditions": ["至少一台已连接"],
      "happy_path": ["PAGE-006 切 Tab 到 PAGE-007", "卡片可见", "点开复用会话回 PAGE-006"],
      "error_paths": ["会话恰好失效走 FLOW-004"],
      "cancel_and_cleanup": ["页面 unload 仅摘 UI 订阅；会话归 Registry"],
      "pages": ["PAGE-006", "PAGE-007"], "mermaid_diagrams": 2,
      "planned_tests": ["TEST-I-006", "TEST-A-009", "TEST-W-008"],
      "evidence_id": "EVID-001", "release_blocking": true
    },
    {
      "id": "FLOW-007", "name": "多设备",
      "actors": ["用户", "Registry", "两台设备"],
      "preconditions": ["首台已连接"],
      "happy_path": ["回扫描连第二台", "双会话 N=2", "同 UUID Notify 隔离", "断 A 不影响 B"],
      "error_paths": ["达上限提示 DEC-008", "断开错误不影响另一台"],
      "cancel_and_cleanup": ["单断/全断统一入口清理订阅与会话"],
      "pages": ["PAGE-001", "PAGE-006", "PAGE-007"], "mermaid_diagrams": 2,
      "planned_tests": ["TEST-I-005", "TEST-I-006", "TEST-A-009", "TEST-W-009"],
      "evidence_id": "EVID-002", "release_blocking": true
    },
    {
      "id": "FLOW-008", "name": "手机 Peripheral",
      "actors": ["用户", "BroadcastOwner", "ESP32 Observer"],
      "preconditions": ["PAGE-008 支持就绪", "无活动连接"],
      "happy_path": ["编辑字段预算≤31", "开始实际成功", "广播中", "Observer 观测一致", "停止释放"],
      "error_paths": ["32 字节阻止", "ERR-PERI-05 冲突先断开", "ERR-PERI-06/07 启停失败", "ERR-PERM/ERR-BT 恢复"],
      "cancel_and_cleanup": ["hide/unload 自动停止并释放 Owner"],
      "pages": ["PAGE-008"], "mermaid_diagrams": 2,
      "planned_tests": ["TEST-U-014", "TEST-I-007", "TEST-A-010", "TEST-W-009", "TEST-E-006"],
      "evidence_id": "EVID-004", "release_blocking": true
    },
    {
      "id": "FLOW-009", "name": "OTA 完整事务",
      "actors": ["用户", "OtaManager", "设备"],
      "preconditions": ["设备含 OTA 服务", "入口达标 DEC-001", "固件包（manifest+bin，PROTO-011/DEC-016）六项校验通过（FEAT-081）"],
      "happy_path": ["第 0 步包校验通过", "订阅 STATUS", "CTRL start（含 target/sha256）", "ready", "DATA 分包按序（V1 无单块重传）", "CTRL commit（设备复核 size+SHA256）", "success", "reboot", "重连", "版本回读一致成功"],
      "error_paths": ["ERR-OTA-09..13 包校验失败不进事务", "ERR-OTA-02 无 ready", "ERR-OTA-03 data 失败/丢块/乱序整事务重试", "ERR-OTA-04 无 success", "ERR-OTA-05 版本不一致", "ERR-OTA-07 abort 失败", "ERR-OTA-08 重连失败"],
      "cancel_and_cleanup": ["取消=CTRL abort 设备回 idle；失败/丢块/断链=事务 FAIL 回 idle 后从 CTRL start 重新完整发起（V1 无断点续传）；事务资源终态释放"],
      "pages": ["PAGE-006"], "mermaid_diagrams": 2,
      "planned_tests": ["TEST-U-016", "TEST-I-008", "TEST-I-010", "TEST-A-011", "TEST-E-007"],
      "evidence_id": "EVID-006", "release_blocking": true
    },
    {
      "id": "FLOW-010", "name": "Smart HID 首次配网",
      "actors": ["用户", "SmartHidWorkflow", "设备", "ControlHub"],
      "preconditions": ["扫描发现强/弱匹配", "ControlHub 运行并已出 QR"],
      "happy_path": ["连接+INFO 确认", "表单", "扫码", "waiter 先注册再分帧写", "四步进度", "ready 写历史释放连接"],
      "error_paths": ["八类错误各唯一恢复", "ERR-HID-09 身份断开", "ERR-HID-11 QR 无效", "ERR-HID-12 超时"],
      "cancel_and_cleanup": ["取消=断开回表单；配网连接终态释放"],
      "pages": ["PAGE-001", "PAGE-002"], "mermaid_diagrams": 2,
      "planned_tests": ["TEST-U-015", "TEST-I-009", "TEST-H-001", "TEST-H-002", "TEST-H-003", "TEST-W-010"],
      "evidence_id": "EVID-005", "release_blocking": true
    },
    {
      "id": "FLOW-011", "name": "Smart HID 历史/诊断/重配",
      "actors": ["用户", "历史数据", "诊断服务"],
      "preconditions": ["存在历史记录"],
      "happy_path": ["PAGE-004 列表", "PAGE-003 快照", "诊断自动一次出五项", "或重配走 PAGE-002 更新历史"],
      "error_paths": ["ERR-DATA-03 记录不存在", "离线确认连接", "ERR-HID-13 重试"],
      "cancel_and_cleanup": ["owned 离页断开；borrowed 保持"],
      "pages": ["PAGE-003", "PAGE-004", "PAGE-005", "PAGE-002"], "mermaid_diagrams": 2,
      "planned_tests": ["TEST-P-003", "TEST-P-004", "TEST-P-005", "TEST-H-004", "TEST-H-005", "TEST-H-006"],
      "evidence_id": "EVID-005", "release_blocking": true
    },
    {
      "id": "FLOW-012", "name": "关于/分享/反馈",
      "actors": ["用户", "页面", "外部渠道"],
      "preconditions": [],
      "happy_path": ["PAGE-009 查看版本/平台状态", "PAGE-010 版本记录", "分享/反馈入口可达"],
      "error_paths": ["外链失败 modal", "ERR-DATA-05 dev.unknown"],
      "cancel_and_cleanup": ["无资源"],
      "pages": ["PAGE-009", "PAGE-010"], "mermaid_diagrams": 2,
      "planned_tests": ["TEST-P-009", "TEST-P-010", "TEST-A-012", "TEST-W-010", "TEST-R-005"],
      "evidence_id": "EVID-007", "release_blocking": true
    },
    {
      "id": "FLOW-013", "name": "落地页体验/下载/ESP32",
      "actors": ["访客", "落地页", "Release 产物", "ESP32 教程"],
      "preconditions": [],
      "happy_path": ["Hero→能力卡→证据", "下载 APK/码/固件含 SHA", "或三条快速开始之一"],
      "error_paths": ["ERR-WEB-01..03 发布前阻断", "无产物 NOT_RELEASED 面"],
      "cancel_and_cleanup": ["静态页无资源"],
      "pages": ["WEB-001"], "mermaid_diagrams": 2,
      "planned_tests": ["TEST-R-001", "TEST-R-002", "TEST-R-003", "TEST-R-005", "TEST-R-006", "TEST-R-007", "TEST-R-008", "TEST-R-009", "TEST-E-008"],
      "evidence_id": "EVID-007", "release_blocking": true
    },
    {
      "id": "FLOW-014", "name": "Release 后新安装与首次联调",
      "actors": ["新用户", "新电脑", "ESP32", "App/小程序"],
      "preconditions": ["一次已通过 E6 的 Release"],
      "happy_path": ["下载 SHA 校验安装", "教程烧写 fixture_peripheral", "扫描发现", "连接写 FF01 灯亮", "订阅 Notify", "可选 Observer 验证"],
      "error_paths": ["安装失败系统指引", "烧写失败故障表", "扫描失败回 FLOW-001"],
      "cancel_and_cleanup": ["首会话正常建立"],
      "pages": ["PAGE-001", "PAGE-006", "WEB-001"], "mermaid_diagrams": 2,
      "planned_tests": ["TEST-R-001", "TEST-R-008", "TEST-E-008", "TEST-A-014"],
      "evidence_id": "EVID-008", "release_blocking": true
    }
  ]
}
